Event.Id,Investigation.Type,Event.Date,Location,Country,Injury.Severity,Aircraft.damage,Aircraft.Category,Make,Model,Amateur.Built,Number.of.Engines,Engine.Type,FAR.Description,Schedule,Purpose.of.flight,Air.carrier,Total.Fatal.Injuries,Total.Serious.Injuries,Total.Minor.Injuries,Total.Uninjured,Weather.Condition,Broad.phase.of.flight,Report.Status,Event.Year
20171030X60823,Accident,2017-10-06,"Las Vegas, NV",United States,Non-Fatal,Substantial,Helicopter,ROBINSON HELICOPTER,R22 BETA,No,1.0,Reciprocating,091,,Instructional,,0.0,0.0,0.0,2.0,VMC,,"The student pilots tension on the flight control at a low level during an autorotation, which did not allow sufficient time for the flight instructor to correct and recover control before the hard landing.  
",2017.0
20171108X90648,Accident,2017-10-08,"Namur, Belgium",Belgium,Non-Fatal,Substantial,Helicopter,ROBINSON,R44,No,1.0,Reciprocating,NUSN,,,Best in Sky,0.0,4.0,0.0,0.0,VMC,,,2017.0
20171007X12417,Accident,2017-10-13,"Arbuckle, CA",United States,Non-Fatal,Substantial,Helicopter,WESTERN INTERNATIONAL AVIA INC,UH 1H,No,,Turbo Shaft,091,,Positioning,,0.0,0.0,0.0,1.0,VMC,,A collective control malfunction for reasons that could not be determined.,2017.0
20171016X23330,Accident,2017-10-13,"Canton, IL",United States,Non-Fatal,Substantial,Helicopter,EUROCOPTER DEUTSCHLAND GMBH,MBB BK 117,No,2.0,Turbo Shaft,091,,Instructional,OSF AVIATION LLC.,0.0,0.0,0.0,2.0,VMC,,"The flight instructor's incorrect cyclic control during a hover, which resulted in a hard landing.",2017.0
20171017X22730,Accident,2017-10-17,"Molokai, HI",United States,Fatal,Destroyed,Helicopter,ROBINSON HELICOPTER,R44,No,1.0,Reciprocating,091,,Instructional,Mauna Loa Helicopters,2.0,0.0,0.0,0.0,IMC,,A descent and subsequent impact with open ocean waters for reasons that could not be determined based on the available information.,2017.0
20171025X21112,Accident,2017-10-24,"Arlington, WA",United States,Fatal,Substantial,Helicopter,ROBINSON,R22,No,1.0,Reciprocating,091,,Personal,,1.0,1.0,0.0,0.0,VMC,,The pilot's failure to maintain adequate clearance from the water while maneuvering at low altitude.,2017.0
20171025X82017,Accident,2017-10-24,"Groom, TX",United States,Non-Fatal,Substantial,Helicopter,BELL,206B,No,1.0,Turbo Shaft,137,,Aerial Application,,0.0,0.0,0.0,1.0,VMC,,The total loss of engine power due to fuel starvation. Contributing to the accident was the pilots decision to operate the helicopter with minimum fuel on board. ,2017.0
20171031X55947,Accident,2017-10-26,"La Paloma, TX",United States,Non-Fatal,Substantial,Helicopter,AIRBUS HELICOPTERS,EC 130,No,1.0,Turbo Shaft,091,,Air Drop,Richardson Aviation,0.0,0.0,0.0,3.0,VMC,,"The separation of a weight from the gunners net, which struck the helicopters main rotor blade during flight.
",2017.0
20171106X75406,Accident,2017-11-06,"Larchwood, IA",United States,Non-Fatal,Substantial,Helicopter,ROBINSON HELICOPTER,R44,No,1.0,Reciprocating,091,,Aerial Observation,,0.0,0.0,2.0,0.0,IMC,,"The pilot's loss of situational awareness, which resulted in his failure to maintain adequate clearance from powerlines.",2017.0
20171108X94652,Accident,2017-11-07,"Rolling Fork, MS",United States,Non-Fatal,Substantial,Helicopter,BELL,206,No,,Turbo Shaft,137,,Aerial Application,Provine Helicopter Service Inc,0.0,1.0,0.0,0.0,VMC,,An uncommanded yaw and subsequent loss of main rotor rpm for reasons that could not be determined. ,2017.0
20171108X41027,Accident,2017-11-08,"Union City, TN",United States,Non-Fatal,Substantial,Helicopter,BELL,206,No,1.0,Turbo Shaft,091,,Other Work Use,AIR EVAC EMS INC,0.0,3.0,0.0,0.0,VMC,,,2017.0
20171112X42004,Accident,2017-11-11,"Page, AZ",United States,Non-Fatal,Substantial,Helicopter,ROBINSON HELICOPTER,R44,No,1.0,Reciprocating,091,,Personal,,0.0,2.0,0.0,0.0,VMC,,The pilot's failure to maintain pitch control of the helicopter while transitioning from a hover to forward flight.,2017.0
20171128X94825,Accident,2017-11-18,"Emerald Aerodrome, Australia",Australia,Non-Fatal,Substantial,Helicopter,BELL HELICOPTER CO,206B,No,1.0,Turbo Shaft,UNK,NSCH,,HELISTAR AVIATION PTY LTD,0.0,0.0,0.0,2.0,,,,2017.0
20171119X32831,Accident,2017-11-20,"Stuttgart, AR",United States,Fatal,Destroyed,Helicopter,BELL HELICOPTER TEXTRON CANADA,407,No,1.0,Turbo Shaft,135,NSCH,,AIR METHODS CORP,3.0,0.0,0.0,0.0,VMC,,An in-flight loss of control due to bird strikes.,2017.0
20171120X90940,Accident,2017-11-20,"Electra, TX",United States,Fatal,Substantial,Helicopter,ROBINSON HELICOPTER,R22 BETA,No,1.0,Reciprocating,091,,Other Work Use,Carmichael Helicopter Service LLC,1.0,0.0,0.0,0.0,VMC,,The pilot's failure to maintain clearance from powerlines while maneuvering at low altitude.,2017.0
20171122X32450,Accident,2017-11-22,"Woodlawn, VA",United States,Non-Fatal,Substantial,Helicopter,HUGHES,300,No,1.0,Reciprocating,091,,Personal,,0.0,0.0,0.0,2.0,VMC,,"The pilots inappropriate descent profile during landing with a quartering gusting tailwind, which resulted in a loss of main rotor rpm.
",2017.0
20171205X01542,Accident,2017-11-22,"La Morita, Mexico",Mexico,Fatal,Destroyed,Helicopter,MD HELICOPTER,369HS,No,,Turbo Shaft,NUSN,,Aerial Observation,City of Tijuana,2.0,0.0,0.0,0.0,VMC,,,2017.0
20171201X51708,Accident,2017-11-29,"New Orleans, LA",United States,Non-Fatal,Substantial,Helicopter,ROBINSON HELICOPTER COMPANY,R44,No,1.0,Reciprocating,091,,Positioning,,0.0,0.0,0.0,2.0,VMC,,"The pilots failure to land the helicopter with both skids on the trailer platform, which resulted in a loss of control.
",2017.0
20171201X80124,Accident,2017-11-30,"Truckee, CA",United States,Non-Fatal,Substantial,Helicopter,ROBINSON HELICOPTER COMPANY,R22,No,1.0,Reciprocating,091,,Personal,TUMBLEWEED LEASING CO INC,0.0,0.0,2.0,0.0,,,,2017.0
20180109X61608,Accident,2017-12-02,"Bacoor, Philippines",Philippines,Non-Fatal,Substantial,Helicopter,ENSTROM,480,No,,,UNK,,,,0.0,1.0,0.0,1.0,,,,2017.0
20171205X35855,Accident,2017-12-05,"Fort Pierce, FL",United States,Non-Fatal,Substantial,Helicopter,ROBINSON HELICOPTER,R44,No,1.0,Reciprocating,091,,Personal,ATLAS AVIATION LP,0.0,1.0,0.0,1.0,VMC,,"The pilots improper landing flare, which resulted in a tail strike and hard landing.
",2017.0
20171206X02103,Accident,2017-12-05,"Dubovaya Balka, Russia",Russia,Fatal,Substantial,Helicopter,ROBINSON,R44,No,,,UNK,,,Barkol Airlines,2.0,0.0,0.0,0.0,,,,2017.0
20171207X14956,Accident,2017-12-06,"Santa Rosa, AZ",United States,Non-Fatal,Substantial,Helicopter,EUROCOPTER,AS 350,No,1.0,Turbo Shaft,PUBU,,Public Aircraft,US DEPARTMENT OF HOMELAND SECURITY,0.0,0.0,0.0,2.0,VMC,,"The pilots improper landing flare, which resulted in a hard landing.
",2017.0
20171219X21630,Accident,2017-12-13,"Newark, OH",United States,Non-Fatal,Substantial,Helicopter,ROBINSON HELICOPTER COMPANY,R44,No,1.0,Reciprocating,091,,Positioning,,0.0,1.0,0.0,0.0,VMC,,"The pilots failure to maintain lateral control of the helicopter during takeoff, which resulted in dynamic rollover.
",2017.0
20171215X01947,Accident,2017-12-15,"Islamorada, FL",United States,Non-Fatal,Substantial,Helicopter,SIKORSKY,S76,No,2.0,Turbo Shaft,135,NSCH,,Global Sky Air Charter Corp.,0.0,0.0,0.0,1.0,VMC,,"The pilot's activation of the rotor brake while the No. 2 engine was still set to govern the power turbine speed, which resulted in continuous power being applied to the rotor while the rotor brake was engaged and led to excessive friction, heat, and a subsequent fire in the area of the rotor brake.   ",2017.0
20171217X61759,Accident,2017-12-17,"Caldwell, ID",United States,Non-Fatal,Substantial,Helicopter,GRAY JIM ROBERT,EXEC,Yes,1.0,Reciprocating,091,,Personal,,0.0,0.0,0.0,1.0,VMC,,"Failure of the oil pressure gauge line, which resulted in oil exhaustion and a total loss of engine power.",2017.0
20171222X21314,Accident,2017-12-21,"Bredasdorp, South Africa",South Africa,Non-Fatal,Substantial,Helicopter,BELL,UH1H,No,,,UNK,,,,0.0,1.0,0.0,0.0,,,,2017.0
20180110X40647,Accident,2018-01-05,"Norfolk, NE",United States,Non-Fatal,Substantial,Helicopter,BELL HELICOPTER TEXTRON CANADA,407,No,1.0,Turbo Shaft,091,,Positioning,AIR METHODS CORP,0.0,0.0,0.0,3.0,VMC,,"Maintenance personnels failure to properly secure the tail rotor drive shaft cover, which resulted in the cover departing the helicopter in flight.",2018.0
20180109X21216,Accident,2018-01-08,"Albany, TX",United States,Non-Fatal,Substantial,Helicopter,ROBINSON HELICOPTER COMPANY,R44 II,No,1.0,Reciprocating,091,,Personal,,0.0,0.0,0.0,1.0,VMC,,A loss of helicopter control for reasons that could not be determined because postaccident examination did not reveal any evidence of mechanical malfunctions or failures of the main rotor and tail rotor systems that would have precluded normal operation.,2018.0
20180116X54101,Accident,2018-01-12,"Van Nuys, CA",United States,Non-Fatal,Substantial,Helicopter,BELL,UH 1H,No,1.0,Turbo Shaft,PUBU,,Positioning,Santa Barbara County Air Support Unit,0.0,0.0,0.0,2.0,VMC,,"The pilots failure to maintain clearance from a stationary helicopter during landing. Contributing to the accident was the ground crews failure to ensure that the helicopter would clear the stationary helicopter. 
",2018.0
20180115X33637,Accident,2018-01-15,"Perrysburg, OH",United States,Fatal,Substantial,Helicopter,MD HELICOPTERS INC,369HM,No,1.0,Turbo Shaft,091,,Aerial Observation,VISTA One INC,2.0,0.0,0.0,0.0,IMC,,"A loss of engine power due to snow or ice ingestion at an altitude that was insufficient to allow for engine re-ignition. Contributing to the accident were conditions, including altitude and flat light conditions, that precluded a successful autorotation to the field.",2018.0
20180601X21623,Accident,2018-01-17,"Ayers Rock, Australia",Australia,Non-Fatal,Substantial,Helicopter,ROBINSON,R44,No,1.0,Reciprocating,UNK,,,,0.0,2.0,2.0,0.0,,,,2018.0
20180118X03803,Accident,2018-01-18,"Raton, NM",United States,Fatal,Destroyed,Helicopter,BELL,UH-1H,No,1.0,Turbo Shaft,091,,Personal,SAPPHIRE AVIATION LLC,5.0,0.0,1.0,0.0,VMC,,"The pilot's failure to maintain adequate altitude above mountainous terrain during cruise flight in dark night conditions, which resulted in controlled flight into terrain.",2018.0
20180122X00701,Accident,2018-01-21,"LOXAHATCHEE, FL",United States,Non-Fatal,Destroyed,Helicopter,MOSQUITO,XEL,Yes,1.0,Reciprocating,091,,Personal,,0.0,0.0,1.0,0.0,VMC,,The noncertificated pilot's failure to maintain helicopter control during takeoff. Contributing to the accident were the pilot's lack of recent flight experience and his lack of training and experience in the accident helicopter make and model.,2018.0
20180123X52142,Accident,2018-01-22,"Cahokia, IL",United States,Non-Fatal,Substantial,Helicopter,HELICOPTERES GUIMBAL,CABRI G2,No,1.0,Reciprocating,091,,Instructional,D H HELICOPTER INC,0.0,2.0,0.0,0.0,VMC,,"The student pilot's failure to maintain yaw control while landing in gusting crosswind conditions and the flight instructor's delayed remedial action. 

 
",2018.0
20180124X00523,Accident,2018-01-23,"Recife, Brazil",Brazil,Fatal,Substantial,Helicopter,ROBINSON,R44,No,1.0,Reciprocating,NUSN,,Aerial Observation,HELISAE SERV. AEREO ESPECIALIZADO LTDA,2.0,0.0,1.0,0.0,,,,2018.0
20180124X93109,Accident,2018-01-24,"Fort Lauderdale, FL",United States,Non-Fatal,Substantial,Helicopter,SCHWEIZER,269C,No,1.0,Reciprocating,091,,Instructional,Pelican Flight Training LLC.,0.0,0.0,0.0,2.0,VMC,,The partial loss of engine power during the initial climb due to a stuck intake valve on the No. 4 cylinder.,2018.0
20180126X10900,Accident,2018-01-26,"Pacific Ocean, Japan",Japan,Non-Fatal,Substantial,Helicopter,EUROCOPTER FRANCE,SA330J PUMA,No,2.0,Turbo Shaft,133,,Other Work Use,Erickson Helicopters,0.0,0.0,0.0,2.0,VMC,,"The worn rear bearing of the freewheel unit. Contributing to the accident was the delay in analyzing an oil sample, which would have detected the increase in metal contaminants from the worn bearing.",2018.0
20180130X64322,Accident,2018-01-26,"Loveland, CO",United States,Non-Fatal,Substantial,Helicopter,ROBINSON HELICOPTER COMPANY,R44 II,No,1.0,Reciprocating,091,,Personal,,0.0,1.0,0.0,2.0,VMC,,"The airplane pilots failure to see and avoid the helicopter while in the traffic pattern, which resulted in a midair collision between the two aircraft. Contributing to the accident was the airplane pilots misunderstanding of the helicopter pilots intentions and the airplane pilots expectation that the helicopter would be clear of the runway.",2018.0
20180127X31420,Accident,2018-01-27,"Pomeroy, WA",United States,Fatal,Substantial,Helicopter,HUGHES,369D,No,,Turbo Shaft,091,,Other Work Use,Kiwi Air,1.0,0.0,2.0,0.0,VMC,,A loss of control following the gunner's failure to ensure that the net maintained clearance from the tail rotor.,2018.0
20180128X60946,Accident,2018-01-28,"Homstead, FL",United States,Non-Fatal,Substantial,Helicopter,ROBINSON HELICOPTER,R22,No,1.0,Reciprocating,091,,Other Work Use,,0.0,0.0,0.0,1.0,VMC,,"The pilots diverted attention to his phone while maneuvering at a low altitude, which resulted in collision with terrain.
",2018.0
20180129X21947,Accident,2018-01-28,"Harrisville, NY",United States,Non-Fatal,Substantial,Helicopter,VERTICAL AVIATION TECHNOLOGIES,260L HUMMINGBIRD,Yes,1.0,Reciprocating,091,,Personal,,0.0,0.0,0.0,1.0,VMC,,"The failure of an electric fuel pump, which resulted in fuel starvation and a total loss of engine power during cruise flight.",2018.0
20180129X83947,Accident,2018-01-29,"Zebulon, GA",United States,Non-Fatal,Substantial,Helicopter,BELL,OH 58C,No,1.0,Turbo Shaft,PUBU,,Instructional,SPALDING COUNTY SHERIFFS OFFICE,0.0,0.0,0.0,2.0,VMC,,The pilot's failure to fully open the throttle before initiating the power recovery in response to a simulated engine failure.,2018.0
20180130X82722,Accident,2018-01-30,"Newport Beach, CA",United States,Fatal,Destroyed,Helicopter,ROBINSON HELICOPTER,R44,No,1.0,Reciprocating,091,,Personal,,3.0,0.0,1.0,0.0,VMC,,"The pilot's failure to perform weight and balance calculations before departing on the flight, which resulted in his operation of the helicopter outside of its published weight and balance limitations and a subsequent loss of control shortly after takeoff.",2018.0
20180201X35955,Accident,2018-02-01,"Wrightwood, CA",United States,Non-Fatal,Substantial,Helicopter,HUGHES HELICOPTERS INC,369,No,1.0,Turbo Shaft,135,NSCH,,"Western Helicopters, Inc.",0.0,0.0,0.0,3.0,VMC,,"The pilots high altitude, high gross weight landing with insufficient tail rotor thrust resulting in a loss of tail rotor effectiveness.
",2018.0
20180205X92908,Accident,2018-02-01,"Marchwood, New Hampshire, United Kingdom",United Kingdom,Non-Fatal,Substantial,Helicopter,SIKORSKY,S61,No,,,UNK,,,,0.0,0.0,0.0,0.0,,,,2018.0
20180214X11435,Accident,2018-02-02,"St Joachim de Courval, Canada",Canada,Fatal,Destroyed,Helicopter,ROBINSON,R44,No,1.0,Reciprocating,NUSN,,Personal,,3.0,0.0,0.0,0.0,,,,2018.0
20180405X62057,Accident,2018-02-04,"Uetersen, Germany",Germany,Non-Fatal,Substantial,Helicopter,BELL,206,No,,,NUSN,,,,0.0,1.0,0.0,0.0,,,,2018.0
20180211X43513,Accident,2018-02-05,"Lanyu, Taiwan (Province of China)",Taiwan,Fatal,Destroyed,Helicopter,SIKORSKY,UH-60M (S-70),No,2.0,Turbo Shaft,129,,,National Airborne Service Corps. Taiwan,6.0,0.0,0.0,0.0,,,,2018.0
20180210X14603,Accident,2018-02-11,"Peach Springs, AZ",United States,Fatal,Destroyed,Helicopter,EUROCOPTER,EC130,No,1.0,Turbo Shaft,135,NSCH,,"Papillon Airways, Inc.",5.0,0.0,2.0,0.0,VMC,,"A loss of tail rotor effectiveness, the pilots subsequent loss of helicopter control, and collision with terrain during an approach to land in gusting, tailwind conditions in an area of potential downdrafts and turbulence. ",2018.0
20180212X32901,Accident,2018-02-12,"Heber City, UT",United States,Non-Fatal,Substantial,Helicopter,HUGHES,369,No,1.0,Turbo Shaft,091,,Other Work Use,HELIWILD INVESTMENTS LLC,0.0,0.0,0.0,2.0,VMC,,"The pilots failure to maintain clearance from an elk while maneuvering at a low altitude.
",2018.0
20180214X44852,Accident,2018-02-13,"Wadsworth, TX",United States,Non-Fatal,Substantial,Helicopter,ROBINSON HELICOPTER,R22,No,1.0,Reciprocating,091,,Other Work Use,,0.0,1.0,0.0,1.0,VMC,,"The passengers gun becoming lodged in the flight controls during takeoff and his failure to remove it, which resulted in impact with terrain.
",2018.0
20180221X55131,Accident,2018-02-13,"Stockbridge, MI",United States,Non-Fatal,Substantial,Helicopter,SCHWEIZER,269D,No,1.0,Turbo Shaft,091,,Personal,C. Aaron LLC,0.0,2.0,0.0,0.0,VMC,,The pilots failure to maintain adequate clearance from terrain while maneuvering the helicopter at a low altitude after departure. Contributing to the accident were the pilots distraction by the smoke in the cabin and the limited visible features in the snow-covered field to discern the helicopters height above the ground.,2018.0
20180214X61821,Accident,2018-02-14,"Charleston, SC",United States,Non-Fatal,Substantial,Helicopter,ROBINSON HELICOPTER,R22,No,1.0,Reciprocating,091,,Instructional,Holy City Helicopters,0.0,0.0,0.0,2.0,VMC,,"The flight instructors abrupt evasive maneuver to avoid a reported unmanned aerial system, which resulted in a loss of forward airspeed and settling with power and a subsequent collision with trees and terrain. ",2018.0
20180223X34238,Accident,2018-02-18,"New Iberia, LA",United States,Non-Fatal,Substantial,Helicopter,SIKORSKY,S76,No,2.0,Turbo Shaft,135,NSCH,,Bristow US LLC,0.0,0.0,0.0,5.0,IMC,,"The helicopters striking of a pothole while taxiing, which resulted in the right main landing gear collapsing.
",2018.0
20180228X03202,Accident,2018-02-19,Pacific Ocean,Pacific Ocean,Non-Fatal,Substantial,Helicopter,HUGHES,369D,No,,Turbo Shaft,091,,Aerial Observation,,0.0,2.0,0.0,0.0,VMC,,"An in-flight mechanical malfunction with the helicopter, which necessitated a ditching in the ocean. The reason for the malfunction could be determined because the helicopter sank and was not recovered.",2018.0
20180226X31732,Accident,2018-02-24,"Woodland, CA",United States,Non-Fatal,Substantial,Helicopter,ROBINSON HELICOPTER COMPANY,R44,No,1.0,Reciprocating,091,,Business,FLYING M AIR LLC,0.0,1.0,0.0,0.0,VMC,,"The pilots distraction due to her malfunctioning iPad, which led to her inadvertent forward cyclic application. ",2018.0
20180301X70512,Accident,2018-02-24,"Talkeetna, AK",United States,Non-Fatal,Substantial,Helicopter,ROBINSON HELICOPTER,R44,No,1.0,Reciprocating,091,,Personal,,0.0,0.0,0.0,1.0,VMC,,"The pilots selection of unsuitable terrain for landing, which resulted in a dynamic rollover.",2018.0
20180228X30115,Accident,2018-02-28,"Pixley, CA",United States,Non-Fatal,Substantial,Helicopter,BELL,47G,No,1.0,Reciprocating,137,,Aerial Application,,0.0,0.0,1.0,0.0,VMC,,"A total loss of engine power due to fuel starvation, which resulted from the pilots failure to ensure that adequate fuel was on board for the flight. Contributing to the accident was the pilots self-induced pressure to complete the flight due to impending rain.",2018.0
20180302X81813,Accident,2018-02-28,"Ogies, South Africa",South Africa,Fatal,Destroyed,Helicopter,ROBINSON HELICOPTER COMPANY,R44 II,No,1.0,,UNK,,,,2.0,0.0,0.0,0.0,,,,2018.0
20180306X93227,Accident,2018-03-05,"Sheboygan, WI",United States,Non-Fatal,Substantial,Helicopter,MESSERSCHMITT-BOLKOW-BLOHM,BK 117 B-2,No,2.0,Turbo Shaft,135,NSCH,,Air Methods Corporation,0.0,0.0,0.0,3.0,VMC,,The restricted cyclic control movement for reasons that could not be determined because postaccident examination and testing of the cyclic control system did not reveal any evidence of mechanical malfunctions or failures that would have precluded normal operation.,2018.0
20180312X11452,Accident,2018-03-10,"Jacksonville, FL",United States,Non-Fatal,Substantial,Helicopter,HUGHES,269,No,1.0,Reciprocating,091,,Personal,SKYPRO INDUSTRIES INC,0.0,0.0,0.0,1.0,VMC,,"The pilots failure to maintain rotor rpm during a practice autorotation, which resulted in ground contact and a dynamic rollover.",2018.0
20180311X13013,Accident,2018-03-11,"New York, NY",United States,Fatal,Substantial,Helicopter,AMERICAN EUROCOPTER CORP,AS350B2,No,1.0,Turbo Shaft,091,,Other Work Use,LIBERTY HELICOPTERS INC,5.0,1.0,0.0,0.0,VMC,,"Liberty Helicopters Inc.'s use of a NYONair-provided passenger harness/tether system, which caught on and activated the floor-mounted engine fuel shutoff lever and resulted in the in-flight loss of engine power and the subsequent ditching. Contributing to this accident were (1) Liberty's and NYONair's deficient safety management, which did not adequately mitigate foreseeable risks associated with the harness/tether system interfering with the floor-mounted controls and hindering passenger egress; (2) Liberty allowing NYONair to influence the operational control of Liberty's FlyNYON flights; and (3) the Federal Aviation Administration's inadequate oversight of Title 14 Code of Federal Regulations Part 91 revenue passenger-carrying operations. Contributing to the severity of the accident were (1) the rapid capsizing of the helicopter due to partial inflation of the emergency flotation system and (2) Liberty and NYONair's use of the harness/tether system that hindered passenger egress.",2018.0
20180319X42625,Accident,2018-03-14,"San Antonio, TX",United States,Non-Fatal,Substantial,Helicopter,HUGHES,269,No,1.0,Reciprocating,091,,Personal,JOHN DEER TRUSTEE,0.0,2.0,0.0,0.0,VMC,,"The pilots decision to relinquish the helicopter flight controls to a non-rated passenger during a 3 ft hover. 
",2018.0
20180330X15040,Accident,2018-03-19,"Bloemfontein, South Africa",South Africa,Non-Fatal,Substantial,Helicopter,ROBINSON,R22,No,1.0,Reciprocating,091,,,,0.0,0.0,0.0,1.0,,,,2018.0
20180322X32109,Accident,2018-03-21,"Hardy Reef, Queensland, Australia",Australia,Fatal,Substantial,Helicopter,EUROCOPTER,EC120,No,1.0,Turbo Shaft,UNK,,,Whitsunday Air Services,2.0,2.0,0.0,1.0,,,,2018.0
20180424X95146,Accident,2018-03-23,"Farmingdale, NY",United States,Non-Fatal,Substantial,Helicopter,ROBINSON HELICOPTER,R22,No,1.0,Reciprocating,091,,Instructional,Flying Helicopters Made Easy,0.0,0.0,0.0,2.0,VMC,,"The student pilots rapid lowering of the collective, which resulted in a hard landing. 
",2018.0
20180405X63311,Accident,2018-03-25,"Koblenz-Winningen, Germany",Germany,Non-Fatal,Substantial,Helicopter,ROTORWAY,EXEC,Yes,1.0,,UNK,,,,0.0,0.0,0.0,2.0,,,,2018.0
20180410X73226,Accident,2018-04-01,"Rosario, Brazil",Brazil,Fatal,Substantial,Helicopter,ROBINSON,R44,No,,,NUSN,,,,4.0,0.0,0.0,0.0,,,,2018.0
20180405X83244,Accident,2018-04-05,"Libourne, France",France,Fatal,Destroyed,Helicopter,BELL,47G,No,,Reciprocating,NUSN,,Instructional,,2.0,0.0,0.0,0.0,VMC,,,2018.0
20181126X32626,Accident,2018-04-05,"Crestet, France",France,Fatal,Destroyed,Helicopter,ROTORWAY,EXEC,Yes,1.0,Reciprocating,NUSN,,,Mr. Barnard Foucher,1.0,0.0,0.0,0.0,,,,2018.0
20180408X85603,Accident,2018-04-08,"Smethport, PA",United States,Fatal,Destroyed,Helicopter,MD HELICOPTER,600,No,1.0,Turbo Shaft,133,,Other Work Use,"High Line Helicopters, LLC",2.0,0.0,1.0,0.0,VMC,,"The helicopter pilot's failure to maintain adequate clearance during power line construction work, which resulted in the helicopter's main rotor striking and becoming entangled with a wire and a subsequent dynamic rollover and collision with terrain. Contributing to the accident was the pilot's and linemen's decision to continue work without a secondary safety device installed, which was contrary to standard operating procedures.",2018.0
20180412X25950,Accident,2018-04-11,"Franklin, CA",United States,Non-Fatal,Substantial,Helicopter,ROBINSON HELICOPTER,R22,No,1.0,Reciprocating,091,,Instructional,Capitol Helicopters,0.0,0.0,0.0,2.0,VMC,,"The pilot receiving instructions abrupt cyclic control input during the touch-down autorotation.
",2018.0
20180423X81729,Accident,2018-04-11,"Vereda Plateado, Colombia",Colombia,Non-Fatal,Substantial,Helicopter,BELL,206,No,,,NUSN,,,,0.0,0.0,0.0,1.0,,,,2018.0
20180423X81347,Accident,2018-04-15,"Vereda Plateado, Colombia",Colombia,Fatal,Substantial,Helicopter,BELL,206L-4,No,,,NUSN,,,,0.0,2.0,0.0,0.0,,,,2018.0
20180507X13800,Accident,2018-04-17,"Talbingo NSW, Australia",Australia,Non-Fatal,Destroyed,Helicopter,GARLICK,UH1H,No,,,UNK,,,,0.0,0.0,1.0,0.0,,,,2018.0
20180621X91915,Accident,2018-04-17,"Nova Esperanca, Brazil",Brazil,Non-Fatal,Substantial,Helicopter,BELL HELICOPTER,407,No,1.0,Turbo Shaft,NUSN,,Public Aircraft,DEPARTAMENTO DE POLICIA RODOV.FEDERAL,0.0,0.0,0.0,4.0,,,,2018.0
20180424X83850,Accident,2018-04-18,"Sonora, TX",United States,Non-Fatal,Substantial,Helicopter,ROBINSON HELICOPTER,R44,No,1.0,Reciprocating,091,,Aerial Observation,,0.0,0.0,0.0,2.0,VMC,,"The pilots failure to maintain clearance from trees while maneuvering at a low altitude.
",2018.0
20180423X85752,Accident,2018-04-20,"Fairbanks, AK",United States,Non-Fatal,Substantial,Helicopter,ROBINSON HELICOPTER COMPANY,R44,No,1.0,Reciprocating,091,,Personal,,0.0,0.0,0.0,1.0,VMC,,"The pilot's failure to maintain helicopter control while in a hovering turn, which resulted in a collision with obstacles.",2018.0
20180425X01358,Accident,2018-04-24,"Albion, NY",United States,Non-Fatal,Destroyed,Helicopter,HEARD ALAN E,MOSQUITO XE,Yes,1.0,Reciprocating,091,,Personal,,0.0,0.0,1.0,0.0,VMC,,"The pilot's inadvertent, improper configuration of the engine fuel system, which resulted in an excessively lean air-to-fuel ratio and resulted in a loss of engine power; and the pilot's subsequent failure to maintain main rotor rpm following the loss of engine power, which resulted in a hard landing.",2018.0
