Event.Id,Investigation.Type,Event.Date,Location,Country,Injury.Severity,Aircraft.damage,Aircraft.Category,Make,Model,Amateur.Built,Number.of.Engines,Engine.Type,FAR.Description,Schedule,Purpose.of.flight,Air.carrier,Total.Fatal.Injuries,Total.Serious.Injuries,Total.Minor.Injuries,Total.Uninjured,Weather.Condition,Broad.phase.of.flight,Report.Status,Event.Year
20110804X41634,Accident,2011-07-09,"Istok, Russia",Russia,Fatal,Substantial,Helicopter,ROBINSON,R-44,No,1.0,,NUSN,,Positioning,Private,1.0,0.0,0.0,0.0,IMC,,,2011.0
20110710X70735,Accident,2011-07-10,"West Palm Beach, FL",United States,Non-Fatal,Substantial,Helicopter,ROBINSON HELICOPTER,R22 BETA,No,1.0,Reciprocating,091,,Instructional,Ocean Helicopters Inc,0.0,1.0,0.0,1.0,VMC,,"Separation of the auxiliary fuel tank cap, which entered the tail rotor system. Contributing to the accident was the lack of a fuel tank cap restraint.",2011.0
20110718X32318,Accident,2011-07-11,"Burma, PO",United States,Fatal,Substantial,Helicopter,SIKORSKY,S76,No,,,NUSN,,Other Work Use,Heli Union Ltd,3.0,0.0,2.0,4.0,,,To be determined by the government of Burma.,2011.0
20110713X53504,Accident,2011-07-12,"Girardot, Colombia",Colombia,Fatal,Substantial,Helicopter,ROBINSON,R66,No,1.0,Turbo Shaft,NUSN,,Unknown,Juan Pablo Gaviria Aristizabal,2.0,0.0,0.0,0.0,VMC,,,2011.0
20110714X33831,Accident,2011-07-12,"Wenatchee, WA",United States,Non-Fatal,Substantial,Helicopter,HUGHES,269C,No,1.0,Reciprocating,091,,Other Work Use,Applebee Aviation Inc,0.0,2.0,0.0,0.0,VMC,,"The pilot's failure to maintain control while hovering out of ground effect at low altitude, which resulted in the helicopter settling into trees.",2011.0
20110720X35120,Accident,2011-07-20,"Dayton, NJ",United States,Non-Fatal,Substantial,Helicopter,ROBINSON HELICOPTER,R22 BETA,No,1.0,Reciprocating,091,,Aerial Observation,NASSAU HELICOPTERS INC,0.0,0.0,2.0,0.0,VMC,,"The pilot's inadequate compensation for wind during an out-of-ground-effect hover, which resulted in a loss of control due to settling with power and loss of tail rotor effectiveness.",2011.0
20110720X52306,Accident,2011-07-20,"Watsonville, CA",United States,Non-Fatal,Substantial,Helicopter,BELL,47G-5,No,1.0,Reciprocating,137,,Aerial Application,GOMES FARM AIR SERVICE INC,0.0,0.0,0.0,1.0,VMC,,The pilot's failure to maintain clearance from a pole while maneuvering during an aerial application flight.,2011.0
20110726X11121,Accident,2011-07-23,"Temple, OK",United States,Non-Fatal,Substantial,Helicopter,BELL,206B,No,1.0,Turbo Shaft,091,,Aerial Observation,INTERSTATE HELICOPTER INC,0.0,0.0,0.0,3.0,VMC,,The pilots failure to maintain clearance from static power lines.,2011.0
20110726X45143,Accident,2011-07-23,"Broomfield, CO",United States,Non-Fatal,Substantial,Helicopter,ROBINSON HELICOPTER COMPANY,R44 II,No,1.0,Reciprocating,091,,Personal,,0.0,0.0,0.0,1.0,VMC,,A loss of control due to the pilot's diverted attention as a result of an open door.,2011.0
20110726X35906,Accident,2011-07-24,"Cornwall, United Kingdom",United Kingdom,Fatal,Substantial,Helicopter,ROBINSON,R44 II,No,1.0,,NUSN,,Unknown,,1.0,0.0,0.0,0.0,,,,2011.0
20110725X05443,Accident,2011-07-25,"Chelan, WA",United States,Fatal,Substantial,Helicopter,SIKORSKY,S-55B,No,1.0,Reciprocating,091,,Aerial Application,Golden Wings Aviation,1.0,0.0,0.0,0.0,VMC,,The pilots failure to maintain clearance from power lines while maneuvering at a low altitude.,2011.0
20110726X03343,Accident,2011-07-25,"Wilton, IA",United States,Fatal,Substantial,Helicopter,SIKORSKY,UH-34D,No,1.0,Reciprocating,137,,Aerial Application,Southern Helicopter Service LLC,1.0,0.0,0.0,0.0,VMC,,The inadequate performance planning by the pilot that resulted in reduced climb capability while transitioning to an out-of-ground effect hover with a left pedal turn.,2011.0
20110802X61652,Accident,2011-07-25,"Brewster, WA",United States,Non-Fatal,Substantial,Helicopter,SIKORSKY,S-55B,No,1.0,Reciprocating,091,,Other Work Use,Golden Wings,0.0,0.0,0.0,2.0,VMC,,The pilot did not maintain main rotor rpm while hovering in gusting wind conditions.,2011.0
20110728X24422,Accident,2011-07-27,"Fitzroy Crossing, Australia, Australia",Australia,Fatal,Substantial,Helicopter,ROBINSON,R22,No,1.0,Reciprocating,NUSN,,Unknown,Jenyns Pastoral Pty Ltd.,1.0,0.0,0.0,0.0,,,,2011.0
20110729X31635,Accident,2011-07-27,"Nicolett, MN",United States,Non-Fatal,Substantial,Helicopter,BELL,47G-2A,No,1.0,Reciprocating,137,,Aerial Application,SCOTTS HELICOPTERS SERVICE INC,0.0,0.0,0.0,1.0,VMC,,The pilot's failure to maintain control of the helicopter while maneuvering during an aerial application flight.,2011.0
20110729X63202,Accident,2011-07-27,"Troutdale, OR",United States,Non-Fatal,Substantial,Helicopter,EUROCOPTER,AS 350 B3,No,1.0,Turbo Shaft,091,,Positioning,Air Methods,0.0,0.0,0.0,4.0,VMC,,The in-flight separation of the tail rotor drive shaft cover as a result of maintenance personnel not ensuring that it was secured after a maintenance inspection; also causal was the pilots inadequate preflight inspection of the helicopter.,2011.0
20110728X40802,Accident,2011-07-28,"Creston, IL",United States,Non-Fatal,Substantial,Helicopter,TEXAS HELICOPTER CORP,OH-13H/M74A,No,1.0,Reciprocating,137,,Aerial Application,HENDRICKSON FLYING SERVICE INC,0.0,1.0,0.0,0.0,VMC,,"The pilot's failure to maintain adequate skid clearance from the helicopter cart during landing, resulting in a dynamic rollover.",2011.0
20110729X03738,Accident,2011-07-29,"Darlington, MD",United States,Non-Fatal,Substantial,Helicopter,SCHWEIZER,269C,No,1.0,Reciprocating,091,,Positioning,CVC Helicopter Service,0.0,1.0,0.0,0.0,VMC,,"Inadequate maintenance of the helicopter's landing gear dampers, which resulted in a main rotor out-of-balance condition and ground resonance encounter.",2011.0
20110802X02327,Accident,2011-07-30,"Humacao, PR",United States,Non-Fatal,Substantial,Helicopter,EUROCOPTER,AS 350 B3,No,1.0,Turbo Shaft,091,,Personal,HELICORP INC,0.0,0.0,0.0,2.0,VMC,,The pilot's failure to maintain clearance from a building during landing.,2011.0
20110801X43845,Accident,2011-07-31,"Rushford, MN",United States,Non-Fatal,Substantial,Helicopter,GARLICK HELICOPTERS INC,OH-58C,No,1.0,Turbo Shaft,137,,Aerial Application,Kristin E Tellijohn,0.0,0.0,0.0,1.0,VMC,,"The pilot's diverted attention, which resulted in the failure to maintain clearance from  the power line.",2011.0
20110822X51818,Accident,2011-07-31,"Porterville, CA",United States,Non-Fatal,Substantial,Helicopter,BELL,47G,No,1.0,Reciprocating,137,,Aerial Application,Agra Fly,0.0,0.0,0.0,1.0,VMC,,"The pilot's decision to takeoff in a tailwind condition, and his subsequent failure to attain sufficient lift during the takeoff.",2011.0
20110801X62048,Accident,2011-08-01,"Joice, IA",United States,Non-Fatal,Substantial,Helicopter,TEXAS HELICOPTER CORP,OH-13H/M74A,No,1.0,Reciprocating,137,,Aerial Application,SCOTTS HELICOPTER SERVICE INC,0.0,0.0,0.0,1.0,VMC,,The pilot's failure to maintain clearance from the wire.,2011.0
20110803X52229,Accident,2011-08-02,"Charles City, IA",United States,Non-Fatal,Substantial,Helicopter,BELL,47G-2,No,1.0,Reciprocating,137,,Aerial Application,Scotts Helicopter Services Inc,0.0,0.0,1.0,0.0,VMC,,The pilot's failure to refuel the helicopter which resulted in a loss of engine power due to fuel exhaustion.,2011.0
20110806X05109,Accident,2011-08-06,"Chino Hills, CA",United States,Non-Fatal,Substantial,Helicopter,ROTORWAY,EXEC,Yes,1.0,Reciprocating,091,,Instructional,,0.0,0.0,0.0,2.0,VMC,,A total loss of engine power due to fuel exhaustion as a result of both the owner's and the pilot's failure to determine or monitor the remaining fuel quantity during the flight. Contributing to the accident was the manufacturer's lack of fuel consumption rate data for planning purposes.,2011.0
20110808X15538,Accident,2011-08-06,"Metone, IN",United States,Non-Fatal,Substantial,Helicopter,HYDE WILLIAM R,HELICYCLE,Yes,1.0,Turbo Shaft,091,,Personal,HYDE WILLIAM R,0.0,0.0,0.0,1.0,VMC,,The loss of engine power due to fuel starvation as a result of an electrical system failure.,2011.0
20110811X51724,Accident,2011-08-08,"Deer Park, WA",United States,Non-Fatal,Substantial,Helicopter,ROBINSON HELICOPTER,R22 BETA,No,1.0,Reciprocating,091,,Instructional,"Inland Helicopters, Inc.",0.0,0.0,0.0,2.0,VMC,,"The student pilot's failure to maintain control of the helicopter and his delay in relinquishing control to the flight instructor, which resulted in the instructors delayed remedial actions and subsequent hard landing.",2011.0
20110812X73321,Accident,2011-08-11,"Titusville, FL",United States,Non-Fatal,Substantial,Helicopter,ROBINSON,R22,No,1.0,Reciprocating,091,,Ferry,,0.0,0.0,0.0,2.0,VMC,,The private pilot's incorrect manipulation of the engine mixture control which resulted in an inadvertent engine shutdown.,2011.0
20110814X84838,Accident,2011-08-14,"Los Banos, CA",United States,Non-Fatal,Substantial,Helicopter,BELL,47G-3B-2,No,1.0,Turbo Shaft,137,,Aerial Application,Double Springs Helicopters,0.0,0.0,0.0,1.0,VMC,,"The pilots inadequate preflight, and contamination of both the engine compressor section and the main rotor blades, which resulted in reduced performance of the engine and rotor system.",2011.0
20110822X24939,Accident,2011-08-18,"Marree, Australia, Australia",Australia,Fatal,Substantial,Helicopter,AEROSPATIALE,AS355,No,2.0,Turbo Shaft,NUSN,,Other Work Use,Australian Broadcasting Corp,3.0,0.0,0.0,0.0,VMC,,,2011.0
20110826X75418,Accident,2011-08-19,", AO",Brazil,Fatal,Substantial,Helicopter,AGUSTA,AW139,No,,,NUSC,NSCH,,Senior Taxi Aereo Ltda.,4.0,0.0,0.0,0.0,VMC,,,2011.0
20110822X10102,Accident,2011-08-21,"Los Banos, CA",United States,Non-Fatal,Substantial,Helicopter,BELL,47G-4,No,1.0,Turbo Shaft,137,,Aerial Application,DOUBLE SPRINGS LLC,0.0,1.0,0.0,0.0,VMC,,The pilot's failure to maintain clearance from the power poles while maneuvering during low-altitude operations.,2011.0
20110827X00428,Accident,2011-08-26,"Mosby, MO",United States,Fatal,Substantial,Helicopter,EUROCOPTER,AS-350-B2,No,1.0,Turbo Shaft,135,NSCH,,Air Methods Corporation,4.0,0.0,0.0,0.0,VMC,,"The pilot's failure to confirm that the helicopter had adequate fuel on board to complete the mission before making the first departure, his improper decision to continue the mission and make a second departure after he became aware of a critically low fuel level, and his failure to successfully enter an autorotation when the engine lost power due to fuel exhaustion. Contributing to the accident were (1) the pilot's distracted attention due to personal texting during safety-critical ground and flight operations, (2) his degraded performance due to fatigue, (3) the operator's lack of a policy requiring that an operational control center specialist be notified of abnormal fuel situations, and (4) the lack of practice representative of an actual engine failure at cruise airspeed in the pilot's autorotation training in the accident make and model helicopter.",2011.0
20110907X13209,Accident,2011-08-26,"Batesville, TX",United States,Non-Fatal,Substantial,Helicopter,ROBINSON HELICOPTER,R44,No,1.0,Reciprocating,091,,Personal,,0.0,0.0,0.0,1.0,VMC,,"The pilots inadequate preflight inspection that failed to ensure all tie-down clamps were removed prior to takeoff, which resulted in the helicopters dynamic rollover.",2011.0
20110827X20105,Accident,2011-08-27,"Titusville, FL",United States,Non-Fatal,Substantial,Helicopter,SCHWEIZER,269C-1,No,1.0,Reciprocating,091,,Instructional,BRISTOW ACADEMY INC,0.0,1.0,0.0,0.0,VMC,,"The student pilot's landing at an unapproved location, which resulted in a ground fire from the engine exhaust.",2011.0
20110906X02608,Accident,2011-08-28,"St. Ferdinand, Canada",Canada,Fatal,Substantial,Helicopter,ROBINSON,R44,No,1.0,,NUSN,,Unknown,9049-5854 Quebec Inc,4.0,0.0,0.0,0.0,,,,2011.0
20110901X52201,Accident,2011-08-28,"South Malekula, Vanuatu, Malampa",Malampa,Fatal,Substantial,Helicopter,HUGHES,369D,No,1.0,Turbo Shaft,NUSN,,External Load,Vanuatu Helicopters,1.0,2.0,0.0,0.0,VMC,,,2011.0
20110912X14702,Accident,2011-08-29,"Menominee, MI",United States,Non-Fatal,Substantial,Helicopter,ENSTROM,F-28F,No,1.0,Reciprocating,091,,Flight Test,ENSTROM HELICOPTER CORP,0.0,0.0,0.0,1.0,VMC,,The pilot's failure to maintain control of the helicopter during a hover.,2011.0
20110909X31747,Accident,2011-08-30,"Unalaska, AK",United States,Non-Fatal,Substantial,Helicopter,ROBINSON HELICOPTER,R22 BETA,No,1.0,Reciprocating,091,,Personal,BERING PACIFIC RANCHES LTD,0.0,0.0,0.0,1.0,VMC,,A loss of engine power in cruise flight for undetermined reasons.,2011.0
20110929X85621,Accident,2011-08-30,"Sao Sebastiao, Brazil",Brazil,Fatal,Substantial,Helicopter,ROBINSON,R44,No,1.0,,NUSN,,Personal,Seisa Clerman EMP. Imobiliarios Ltd.,3.0,0.0,0.0,0.0,IMC,,,2011.0
20110902X43313,Accident,2011-09-02,"Stockton, CA",United States,Non-Fatal,Substantial,Helicopter,ARROW FALCON EXPORTERS INC,UH-1H,No,1.0,Turbo Shaft,091,,Positioning,P J HELICOPTERS INC,0.0,1.0,0.0,0.0,VMC,,"A total loss of engine power due to the separation of a tooth from the starter-generator drive gear, which resulted in failure of the engine oil pump and subsequent oil starvation.",2011.0
20110903X53441,Accident,2011-09-03,"Heber City, UT",United States,Non-Fatal,Substantial,Helicopter,ENSTROM,280FX,No,1.0,Reciprocating,091,,Other Work Use,Sky Park Helicopters LLC.,0.0,0.0,3.0,0.0,VMC,,"The pilots failure to ensure that there was sufficient fuel onboard to conduct the flight, which resulted in a loss of engine power due to fuel exhaustion. Contributing to the severity of the passengers injuries was the operators failure to provide adequate restraints for the passengers.",2011.0
20110905X15040,Accident,2011-09-03,"St. Petersburg, FL",United States,Non-Fatal,Substantial,Helicopter,ROBINSON HELICOPTER,R22 BETA,No,1.0,Reciprocating,091,,Instructional,Razor Blades Helicopter Inc.,0.0,1.0,0.0,1.0,VMC,,"The commercial pilot's improper recovery from a practice autorotation, resulting in a tailboom strike and subsequent rollover.",2011.0
20110906X85417,Accident,2011-09-03,"Plutonic Aero., Australia, Australia",Australia,Fatal,Substantial,Helicopter,ROBINSON,R44,No,1.0,Reciprocating,NUSN,,Aerial Observation,Wieland Helicopter Company,1.0,0.0,1.0,0.0,VMC,,,2011.0
20110906X05207,Accident,2011-09-04,"Tehachapi, CA",United States,Non-Fatal,Substantial,Helicopter,BELL,205,No,1.0,Turbo Shaft,133,,Public Aircraft - Local,Kern County,0.0,1.0,0.0,0.0,VMC,,"The pilot's inability to adequately execute an emergency autorotation due to the flight's low altitude during external load operations, which resulted in a hard landing. Contributing to the accident was a torsionally overstressed tachometer shaft, which sent erroneous engine rpm readings to the cockpit.",2011.0
20110930X82845,Accident,2011-09-10,"Rio de Janeriro, Brazil",Brazil,Fatal,Substantial,Helicopter,ROBINSON,R44,No,1.0,Reciprocating,NUSN,,Other Work Use,Celso Colombo Filho e Outros,2.0,0.0,0.0,0.0,,,,2011.0
20110916X44706,Accident,2011-09-15,"Spicewood, TX",United States,Non-Fatal,Substantial,Helicopter,BELL,206B,No,1.0,Turbo Shaft,091,,Personal,ON FILE,0.0,0.0,0.0,2.0,VMC,,The pilot did not maintain adequate rotor rpm during a low-altitude maneuvering flight.,2011.0
20110917X04919,Accident,2011-09-15,"Ocate, NM",United States,Non-Fatal,Substantial,Helicopter,ROBINSON HELICOPTER,R44,No,1.0,Reciprocating,091,,Personal,,0.0,1.0,1.0,0.0,VMC,,"The pilots failure to apply carburetor heat, which resulted in the formation of carburetor ice and a partial loss of engine power.",2011.0
20110923X41323,Accident,2011-09-22,"Ramona, CA",United States,Non-Fatal,Substantial,Helicopter,HUGHES,269C,No,1.0,Reciprocating,091,,Instructional,Allen D. Hopkins,0.0,0.0,0.0,2.0,VMC,,"The flight instructors failure to follow the proper procedure while demonstrating a practice autorotation, which resulted in a total loss of engine power and subsequent hard landing.",2011.0
20110927X70957,Accident,2011-09-23,"Seward, AK",United States,Non-Fatal,Substantial,Helicopter,BELL,206 B3,No,1.0,Turbo Shaft,PUBU,NSCH,Public Aircraft - Federal,PATHFINDER AVIATION,0.0,0.0,0.0,3.0,VMC,,"The pilot's failure to maintain clearance from snow-covered terrain during hover in deteriorating weather and flat light conditions, which resulted in a tail rotor strike.",2011.0
20110926X50902,Accident,2011-09-24,"Curren, MI",United States,Fatal,Substantial,Helicopter,ROBINSON HELICOPTER,R44,No,1.0,Reciprocating,091,,Personal,,2.0,0.0,0.0,0.0,IMC,,"The non-instrument-rated pilot's decision to continue visual flight into instrument meteorological conditions, which resulted in controlled flight into trees and the ground. Contributing to the accident was the pilot's impairment from multiple drugs.",2011.0
20110926X63740,Accident,2011-09-24,"Douglas, WY",United States,Non-Fatal,Substantial,Helicopter,ROBINSON,R22 BETA,No,1.0,Reciprocating,091,,Personal,James P Hoeffler,0.0,0.0,0.0,1.0,VMC,,The pilot's failure to maintain yaw control of the helicopter while hover taxiing in gusty wind conditions.,2011.0
20110930X33258,Accident,2011-09-25,"Mataram, West Nusa, Indonesia",Indonesia,Fatal,Substantial,Helicopter,BELL,412SP,No,2.0,,NUSC,NSCH,,PT Airfast Indonesia,2.0,0.0,0.0,0.0,,,,2011.0
20110926X93752,Accident,2011-09-26,"Juneau, AK",United States,Non-Fatal,Substantial,Helicopter,EUROCOPTER,AS 350 BA,No,1.0,Turbo Shaft,135,NSCH,,COASTAL HELICOPTERS INC,0.0,0.0,0.0,2.0,VMC,,"Upslope wind conditions while the helicopter was operating at ground idle, which resulted in the helicopter rollover. Contributing to the accident was the lack of manufacturer data regarding the effect of upslope wind conditions on helicopter ground idle operations.",2011.0
20110927X71137,Accident,2011-09-27,"Ahwahnee, CA",United States,Non-Fatal,Substantial,Helicopter,BELL,47D1,No,1.0,Reciprocating,091,,Personal,Lee Haley,0.0,1.0,1.0,0.0,VMC,,"The pilots failure to maintain adequate main rotor rpm during the landing approach, which resulted in a loss of control.",2011.0
20110928X10123,Accident,2011-09-27,"Clearwater, FL",United States,Non-Fatal,Substantial,Helicopter,ROBINSON HELICOPTER,R44,No,1.0,Reciprocating,091,,Instructional,Razor Blades Helicopters,0.0,1.0,0.0,1.0,VMC,,"The certified flight instructor's delayed remedial action, which resulted in a loss of control and subsequent rollover.",2011.0
20111001X63448,Accident,2011-10-01,"Philip, SD",United States,Fatal,Destroyed,Helicopter,ROBINSON HELICOPTER CO,R66,No,1.0,Turbo Shaft,091,,Personal,P P & J LLC,1.0,0.0,0.0,0.0,VMC,,The in-flight separation of the main rotor mast following a mast bumping event. The reason for the mast bumping event could not be determined due to postaccident damage.,2011.0
20111004X71245,Accident,2011-10-04,"New York, NY",United States,Fatal,Substantial,Helicopter,BELL,206B,No,1.0,Turbo Shaft,091,,Personal,DUDLEY PAUL P,2.0,0.0,1.0,2.0,VMC,,"The pilot's failure to anticipate and correct for conditions (high gross weight, low indicated airspeed, and a right downwind turn) conducive to loss of tail rotor effectiveness (LTE), which resulted in LTE and an uncontrolled spin. Contributing to the accident was the pilots inadequate preflight planning, which resulted in the helicopter being in excess of its maximum allowable gross weight at takeoff.",2011.0
20111005X91033,Accident,2011-10-04,"McAllen, TX",United States,Non-Fatal,Substantial,Helicopter,EUROCOPTER,EC120B,No,1.0,Turbo Shaft,091,,Public Aircraft - State,DEPARTMENT OF HOMELAND SECURITY,0.0,2.0,0.0,0.0,VMC,,"The pilot's improper use of the collective while landing, which resulted in an unrecoverable forward pitching moment. Contributing to the accident was the pilot's improper decision not to go-around.",2011.0
20111006X14650,Accident,2011-10-04,"Hibbing, MN",United States,Non-Fatal,Substantial,Helicopter,ROBINSON HELICOPTER,R22 BETA,No,1.0,Reciprocating,091,,Instructional,Casey M. Hansen,0.0,0.0,0.0,2.0,VMC,,The private pilot's failure to maintain control of the helicopter during the landing flare.,2011.0
20111025X40832,Accident,2011-10-07,"South Pass 93A,",United States,Non-Fatal,Substantial,Helicopter,EUROCOPTER,AS 350 B2,No,1.0,Turbo Shaft,135,NSCH,,ERA HELICOPTERS LLC,0.0,0.0,0.0,3.0,VMC,,Improper centering of the cyclic during a start in gusty wind conditions.,2011.0
20111019X32039,Accident,2011-10-14,"Fort Worth, TX",United States,Non-Fatal,Substantial,Helicopter,HUGHES,269A,No,1.0,Reciprocating,091,,Instructional,ON FILE,0.0,0.0,0.0,2.0,VMC,,The inadvertent entry into ground resonance after a hovering autorotation.,2011.0
20111018X53130,Accident,2011-10-15,"Santa Rosa, Venezuela",Venezuela,Non-Fatal,Substantial,Helicopter,BELL,412,No,,,NUSN,,Business,"Electrificacion del Caroni, CA (EDELCA)",0.0,5.0,1.0,0.0,VMC,,,2011.0
20111027X02557,Accident,2011-10-27,"Colusa, CA",United States,Non-Fatal,Substantial,Helicopter,MCDONNELL DOUGLAS,500D,No,1.0,Turbo Shaft,091,,Other Work Use,PJ Helicopters,0.0,1.0,0.0,0.0,VMC,,"A total loss of engine power while maneuvering at low altitude for reasons that could not be determined because postaccident examinations did not reveal any anomalies that would have precluded normal operation. Contributing to the accident severity was the operation of the helicopter within a portion of the height-velocity regime unfavorable for autorotation. 
",2011.0
20111031X10241,Accident,2011-10-30,"Iliamna, AK",United States,Fatal,Destroyed,Helicopter,EUROCOPTER,AS 350 B2,No,1.0,Turbo Shaft,135,NSCH,,ERA HELICOPTERS LLC,1.0,0.0,0.0,0.0,VMC,,The pilot's loss of control due to sudden medical impairment or incapacitation.,2011.0
20111103X60153,Accident,2011-11-02,"Kapuskasing, Canada",Canada,Fatal,Substantial,Helicopter,BELL,206L,No,1.0,,NUSC,NSCH,,Sunrise Helicopters Inc.,3.0,0.0,0.0,0.0,VMC,,,2011.0
20111104X91020,Accident,2011-11-03,"Noblesville, IN",United States,Non-Fatal,Substantial,Helicopter,EUROCOPTER,EC 130 B4,No,1.0,Turbo Shaft,091,,Personal,SWEETWATER HELICOPTERS LLC,0.0,6.0,0.0,0.0,IMC,,"The hard landing the pilot performed with a quartering tailwind, leading to the helicopter's rollover. Contributing to the accident was the pilots reliance on a weather service that did not provide a primary weather product.",2011.0
20111107X90730,Accident,2011-11-05,"West Palm Beach, FL",United States,Non-Fatal,Substantial,Helicopter,ROBINSON HELICOPTER,R22 BETA,No,1.0,Reciprocating,091,,Personal,Ocean Helicopters Inc,0.0,2.0,0.0,0.0,VMC,,"The pilots failure to maintain airspeed during a low-altitude turn into gusty tailwind conditions, which resulted in a loss of translational lift and settling with power. Contributing to the accident was the pilot's lack of total flight experience.",2011.0
20111108X92118,Accident,2011-11-08,"San Diego, CA",United States,Non-Fatal,Substantial,Helicopter,BELL,47D1,No,1.0,Reciprocating,091,,Instructional,,0.0,0.0,0.0,2.0,VMC,,"The flight instructor's inadequate supervision of the student pilot during a simulated autorotation and the pilots failure to use carburetor heat while operating at reduced engine power while in carburetor icing conditions, which resulted in a loss of engine power.",2011.0
20111110X01102,Accident,2011-11-10,"Pukoo, HI",United States,Fatal,Substantial,Helicopter,EUROCOPTER,EC 130 B4,No,1.0,Turbo Shaft,135,NSCH,,Blue Hawaiian Helicopters,5.0,0.0,0.0,0.0,VMC,,"The pilot's failure to maintain clearance from mountainous terrain while operating in marginal weather conditions, which resulted in the impact of the horizontal stabilizer and lower forward portion of the fenestron with ground and/or vegetation and led to the separation of the fenestron and the pilot's subsequent inability to maintain control. Contributing to the accident was the pilot's decision to operate into an area surrounded by rising terrain, low and possibly descending cloud bases, rain showers, and high wind.",2011.0
20111115X94219,Accident,2011-11-12,"Andratx, Spain",Spain,Fatal,Substantial,Helicopter,HUGHES,500,No,,Turbo Shaft,NUSN,,Personal,,2.0,0.0,0.0,0.0,,,,2011.0
20111123X02155,Accident,2011-11-13,"Carbondale, IL",United States,Non-Fatal,Substantial,Helicopter,MESSERSCHMITT-BOLKOW-BLOHM,BK 117 B-2,No,2.0,Turbo Shaft,135,NSCH,,AIR METHODS CORP,0.0,0.0,0.0,1.0,VMC,,"The main rotor blades contact with the vertical stabilizer during the engine shutdown in strong, gusty wind conditions.",2011.0
20111115X85553,Accident,2011-11-14,"Woodburn, OR",United States,Non-Fatal,Substantial,Helicopter,BELL,206B,No,1.0,Turbo Shaft,133,,External Load,APPLEBEE AVIATION INC,0.0,0.0,1.0,0.0,VMC,,The pilots failure to maintain ground clearance while maneuvering with an external load line.,2011.0
20111116X32140,Accident,2011-11-15,"Grand Canyon, AZ",United States,Non-Fatal,Substantial,Helicopter,WILLIAMS HELICOPTER CORP,UH-1H,No,1.0,Turbo Shaft,091,,Other Work Use,Airwest Helicopters,0.0,0.0,1.0,0.0,VMC,,The loss of main rotor power due to a main rotor transmission failure from a lack of lubrication.,2011.0
20111128X55504,Accident,2011-11-25,"Quito, Spain",Spain,Non-Fatal,Substantial,Helicopter,BELL,212,No,2.0,Turbo Shaft,NUSN,,Flight Test,"Aeromaster Airways, SA",0.0,0.0,4.0,0.0,VMC,,,2011.0
20111130X25004,Accident,2011-11-25,"Hackensack, MN",United States,Fatal,Substantial,Helicopter,ROBINSON HELICOPTER COMPANY,R44 II,No,1.0,Reciprocating,091,,Personal,,1.0,1.0,0.0,0.0,VMC,,The helicopter's sudden yaw and subsequent impact with the water for reasons that could not be determined during postaccident examination of the helicopter and its systems.,2011.0
20111202X00359,Accident,2011-12-01,"Wingate, NC",United States,Non-Fatal,Substantial,Helicopter,BELL,206L-3,No,1.0,Turbo Shaft,091,,Instructional,U S HELICOPTERS INC,0.0,0.0,0.0,2.0,VMC,,The certified flight instructor did not select an adequate landing site for the practice autorotation.,2011.0
