Event.Id,Investigation.Type,Event.Date,Location,Country,Injury.Severity,Aircraft.damage,Aircraft.Category,Make,Model,Amateur.Built,Number.of.Engines,Engine.Type,FAR.Description,Schedule,Purpose.of.flight,Air.carrier,Total.Fatal.Injuries,Total.Serious.Injuries,Total.Minor.Injuries,Total.Uninjured,Weather.Condition,Broad.phase.of.flight,Report.Status,Event.Year
20140824X90735,Accident,2014-08-24,"Long Beach, CA",United States,Non-Fatal,Substantial,Helicopter,ROBINSON HELICOPTER,R22 BETA,No,1.0,Reciprocating,091,,Instructional,Los Angeles Helicopters LLC,0.0,0.0,0.0,2.0,VMC,,The student pilot's failure to maintain helicopter control during a practice hover. Contributing to the accident was the flight instructor's delayed remedial reaction.,2014.0
20140825X61141,Accident,2014-08-25,"Cape May Court House, NJ",United States,Non-Fatal,Substantial,Helicopter,HILLER,UH 12E,No,1.0,Reciprocating,PUBU,,Aerial Observation,CAPE MAY COUNTY MOSQUITO,0.0,1.0,0.0,1.0,VMC,,"The mechanics failure to detect excessive wear on the engines lateral snubber vibration mount during the latest annual inspection, which resulted in an in-flight engine failure and a subsequent forced landing.",2014.0
20140829X05451,Accident,2014-08-25,"Halls Creek, Australia, Australia",Australia,Fatal,Destroyed,Helicopter,ROBINSON HELICOPTER CO,R22 BETA,No,,,,,,YEEDA PASTORAL COMPANY PTY LTD,1.0,0.0,0.0,0.0,,,,2014.0
20140828X32451,Accident,2014-08-27,"Gardnerville, NV",United States,Non-Fatal,Substantial,Helicopter,ROBINSON HELICOPTER,R22 BETA,No,1.0,Reciprocating,091,,Personal,,0.0,1.0,1.0,0.0,VMC,,The pilots failure to monitor the environment and to maintain clearance from wires during takeoff.,2014.0
20140828X53001,Accident,2014-08-28,"Hemet, CA",United States,Non-Fatal,Substantial,Helicopter,AIRBUS HELICOPTERS,AS 350 B3,No,1.0,Turbo Shaft,PUBU,,Public Aircraft - Local,County of Riverside,0.0,2.0,0.0,0.0,VMC,,"The flight instructor's failure to adequately brief and demonstrate the simulated emergency procedure to the pilot under instruction and his delayed remedial action and inadequate supervision during the maneuver, which resulted in an excessive sink rate and a hard landing.
",2014.0
20140902X80413,Accident,2014-09-02,"Willows, CA",United States,Non-Fatal,Substantial,Helicopter,HUGHES,369D,No,1.0,Turbo Shaft,091,,Business,PJ HELICOPTERS INC,0.0,0.0,1.0,0.0,VMC,,"The pilot's failure to adequately secure cargo (a jacket), which resulted in the jacket exiting the cabin compartment and colliding with the tail rotor during cruise flight.",2014.0
20160405X25208,Accident,2014-09-02,"La Mojonera, Mexico",Mexico,Fatal,Destroyed,Helicopter,AGUSTA,AW109,No,,,,,,,2.0,0.0,0.0,0.0,,,,2014.0
20140909X94230,Accident,2014-09-05,"Lincoln, CA",United States,Non-Fatal,Substantial,Helicopter,EUROCOPTER,AS 350 B3,No,1.0,Turbo Shaft,PUBU,,Public Aircraft - State,CALIFORNIA HIGHWAY PATROL,0.0,0.0,0.0,2.0,VMC,,The failure of the engine to provide sufficient power when commanded by the pilot during the power recovery phase of a practice autorotation for reasons that could not be determined because postaccident examination revealed no mechanical malfunctions or failures that would have precluded normal operation.,2014.0
20140910X82654,Accident,2014-09-05,"Roeselare, Belgium",Belgium,Fatal,Destroyed,Helicopter,ROBINSON HELICOPTER,R44,No,1.0,Reciprocating,NUSN,,Personal,,2.0,0.0,0.0,0.0,,,,2014.0
20140908X10448,Accident,2014-09-06,"Macedonia, IA",United States,Fatal,Substantial,Helicopter,ROBINSON HELICOPTER COMPANY,R44 II,No,1.0,Reciprocating,137,,Aerial Application,Johnson Helicopter Services,1.0,0.0,0.0,0.0,VMC,,"The pilots inadequate visual lookout, which resulted in a collision with a static line. 
",2014.0
20140912X71805,Accident,2014-09-11,"Moab, UT",United States,Non-Fatal,Substantial,Helicopter,BELL,407,No,1.0,Turbo Shaft,133,,External Load,MINUTEMAN AVIATION INC,0.0,1.0,0.0,0.0,VMC,,The pilot's failure to ensure adequate clearance from terrain while landing on sloped terrain.,2014.0
20140912X72236,Accident,2014-09-12,"Tombstone, AZ",United States,Non-Fatal,Substantial,Helicopter,BELL,206,No,1.0,Turbo Shaft,135,NSCH,,AIRWEST HELICOPTERS LLC,0.0,0.0,0.0,2.0,VMC,,A partial loss of engine power during cruise flight due to loose B nut fittings and a bent tube as a result of maintenance personnels inadequate inspection of the nuts during the most recent inspection.,2014.0
20140916X11037,Accident,2014-09-14,"Kahului, Maui, HI",United States,Non-Fatal,Substantial,Helicopter,EUROCOPTER,AS 350 B2,No,1.0,Turbo Shaft,091,,Flight Test,HAWAII HELICOPTERS INC,0.0,0.0,0.0,2.0,VMC,,The pilot's failure to maintain clearance from the cart while hovering. Contributing to the accident was the failure of ground personnel to remove the cart from the helipad.,2014.0
20140918X54351,Accident,2014-09-15,"Beaumont, TX",United States,Non-Fatal,Substantial,Helicopter,ROBINSON HELICOPTER,R44,No,1.0,Reciprocating,091,,Personal,,0.0,0.0,0.0,2.0,VMC,,The pilot's loss tail rotor effectiveness while attempting a taxiway side-step during landing. Contributing to the accident was another pilot's failure to ensure the runway was clear before occupying the runway for takeoff.,2014.0
20140917X32247,Accident,2014-09-16,"Flamborough, United Kingdom",United Kingdom,Fatal,Destroyed,Helicopter,AGUSTA BELL,206B,No,1.0,Turbo Shaft,,,,HELI CHARTER LTD,2.0,0.0,0.0,0.0,,,,2014.0
20140918X52446,Accident,2014-09-16,"Amaga, Colombia",Colombia,Non-Fatal,Substantial,Helicopter,ROBINSON,R22 - BETA,No,1.0,Reciprocating,NUSN,,Instructional,Halcones Aviation Flight School,0.0,0.0,0.0,2.0,,,,2014.0
20140923X41257,Accident,2014-09-19,"Cahokia, IL",United States,Non-Fatal,Substantial,Helicopter,ROBINSON HELICOPTER,R22 BETA,No,1.0,Reciprocating,091,,Personal,DED AVIATION LLC,0.0,0.0,0.0,1.0,VMC,,"The pilots poor decision to take off with the clutch warning light illuminated, which resulted in the total failure of the fan assembly due to a lack of lubrication. Contributing to the accident was the mechanics failure to lubricate the lower actuator bearing at the last annual inspection.
 ",2014.0
20140923X00810,Accident,2014-09-22,"Grand Forks, ND",United States,Non-Fatal,Substantial,Helicopter,SCHWEIZER,269C,No,1.0,Reciprocating,091,,Instructional,University of North Dakota,0.0,0.0,0.0,2.0,VMC,,"The flight instructor's inadequate supervision and delayed remedial action during a practice autorotation, which resulted in a tail rotor strike.",2014.0
20140923X44032,Accident,2014-09-22,"Mokuleia, HI",United States,Non-Fatal,Substantial,Helicopter,ROBINSON HELICOPTER,R44,No,1.0,Reciprocating,091,,Personal,,0.0,0.0,0.0,4.0,VMC,,"The pilot's failure to maintain aircraft control during landing with a quartering tailwind, which resulted in a hard landing.",2014.0
20140925X93010,Accident,2014-09-23,"Bolivar, Venezuela",Venezuela,Fatal,Substantial,Helicopter,BELL,206B,No,1.0,Turbo Shaft,NUSN,,Unknown,Aerocopter C.A.,3.0,0.0,0.0,0.0,,,,2014.0
20140929X52153,Accident,2014-09-25,"Nashoba, OK",United States,Non-Fatal,Substantial,Helicopter,BELL,206B,No,1.0,Turbo Shaft,137,,Aerial Application,CHEM AIR INC,0.0,0.0,0.0,1.0,VMC,,The pilot's loss of directional control due a loss of tail rotor effectiveness.,2014.0
20140926X44653,Accident,2014-09-26,"Albuquerque, NM",United States,Non-Fatal,Substantial,Helicopter,ROBINSON HELICOPTER,R22 BETA,No,1.0,Reciprocating,091,,Personal,Vertical Limit Aviation,0.0,1.0,0.0,1.0,VMC,,"The pilot's failure to maintain main rotor rpm during a pinnacle approach, which resulted in a loss of helicopter control and collision with terrain. Contributing to the accident was the pilot's decision to attempt the approach given the helicopter's weight and the high-density altitude.",2014.0
20140928X75554,Accident,2014-09-28,"Gallatin, TN",United States,Fatal,Substantial,Helicopter,EAGLE R&D INC,HELICYCLE,Yes,1.0,Turbo Shaft,091,,Personal,,1.0,0.0,0.0,0.0,VMC,,"The pilot's decision to fly the improperly balanced helicopter at high speed and low altitude, which resulted in a loss of control and collision with terrain. Contributing to the accident were the pilot's depression and resulting degradation of executive function and the pilot's use of a sedating antihistamine, which resulted in impaired mental and motor skills.
",2014.0
20141002X70257,Accident,2014-10-02,"Woodsboro, TX",United States,Non-Fatal,Substantial,Helicopter,BELL,206B,No,1.0,Turbo Shaft,091,,Aerial Observation,"North Texas Helicopters, Inc.",0.0,0.0,3.0,0.0,VMC,,"The pilots failure to recognize and correct for flight conditions conducive to a loss of tail rotor effectiveness, which resulted in a rapid, uncommanded right yaw and subsequent hard landing.",2014.0
20141008X13916,Accident,2014-10-03,"Atlanta, AR",United States,Non-Fatal,Substantial,Helicopter,BELL,206B,No,1.0,Turbo Shaft,091,,Positioning,TERRE HAUTE HELICOPTER INC,0.0,0.0,1.0,0.0,VMC,,"The pilot's inadequate preflight inspection when he did not remove a tie-down strap prior to takeoff, which resulted in a dynamic rollover.",2014.0
20141004X60516,Accident,2014-10-04,"Wichita Falls, TX",United States,Fatal,Destroyed,Helicopter,BELL HELICOPTER TEXTRON,206L 1,No,1.0,Turbo Shaft,135,NSCH,,AIR EVAC EMS INC,3.0,0.0,1.0,0.0,VMC,,"The pilots failure to maintain yaw control when he applied power to execute a go-around at a low airspeed in dark, night conditions, which resulted in a rapid, uncommanded right yaw due to a loss of tail rotor effectiveness.",2014.0
20141024X24524,Accident,2014-10-07,"Mount Arthur, New Zealand, New Zealand",New Zealand,Fatal,Destroyed,Helicopter,ROBINSON,R44 II,No,1.0,Reciprocating,,,,,1.0,0.0,0.0,0.0,,,,2014.0
20141016X24919,Accident,2014-10-16,"Prattville, AL",United States,Non-Fatal,Substantial,Helicopter,BELL,206B,No,1.0,Turbo Shaft,091,,Aerial Observation,ENGLISH AIR SERVICE INC,0.0,0.0,0.0,2.0,VMC,,"The pilot's improper fuel planning, which resulted in a total loss of engine power due to fuel exhaustion.",2014.0
20141020X13547,Accident,2014-10-17,"Lordsburg, NM",United States,Non-Fatal,Substantial,Helicopter,AIRBUS HELICOPTERS,AS 350 B3,No,,Turbo Shaft,PUBU,,Public Aircraft - Federal,US Customs and Border Protection,0.0,1.0,0.0,0.0,VMC,,"The pilots failure to maintain adequate drift control and skid clearance from the ground during takeoff, which resulted in a dynamic rollover when the aft right skid contacted a rock. 
",2014.0
20141030X45050,Accident,2014-10-23,"San Isidro, TX",United States,Non-Fatal,Substantial,Helicopter,BELL,UH1H,No,1.0,Turbo Shaft,PUBU,,Other Work Use,U. S. Customs and Border Protection,0.0,0.0,0.0,3.0,VMC,,The flight crew's failure to ensure that the sliding cabin door was properly secured before the flight.,2014.0
20141024X40111,Accident,2014-10-24,"Harper, TX",United States,Non-Fatal,Substantial,Helicopter,ROBINSON HELICOPTER,R44,No,1.0,Reciprocating,091,,Business,Philip Johnston,0.0,0.0,0.0,2.0,VMC,,The pilot's failure to maintain clearance from trees while maneuvering.,2014.0
20141128X93344,Accident,2014-10-25,"West Palm Beach, FL",United States,Non-Fatal,Substantial,Helicopter,BELL,206B,No,1.0,Turbo Shaft,091,,Personal,HELIX HELICOPTERS,0.0,0.0,0.0,5.0,VMC,,A hard landing for reasons that could not be determined based on the available evidence.,2014.0
20141028X14929,Accident,2014-10-27,"Bisbee, AZ",United States,Non-Fatal,Substantial,Helicopter,EUROCOPTER,AS 350,No,1.0,Turbo Shaft,PUBU,,Public Aircraft - Federal,US DEPT OF HOMELAND SECURITY,0.0,0.0,1.0,0.0,VMC,,"Failure of maintenance personnel to ensure adequate torque of a pneumatic control pipe (P2) fitting, which resulted in a loss of engine power during low altitude flight maneuvers.",2014.0
20141105X83801,Accident,2014-10-29,"Baton Rouge, LA",United States,Non-Fatal,Substantial,Helicopter,ROBINSON HELICOPTER CO,R66,No,1.0,Turbo Shaft,091,,Instructional,"Guidance Academy, LLC",0.0,0.0,0.0,2.0,VMC,,An in-flight bird strike.,2014.0
20141103X22603,Accident,2014-11-01,"Boca Chica, Las Americas",Dominican Republic,Fatal,Substantial,Helicopter,BELL,206B-3,No,,Turbo Shaft,NUSN,,Unknown,,1.0,0.0,1.0,1.0,,,,2014.0
20141110X93949,Accident,2014-11-08,"Angleton, TX",United States,Non-Fatal,Substantial,Helicopter,MOSIER ROBERT S,MOSQUITO XET,Yes,1.0,Turbo Jet,091,,Personal,Charles Burgoon,0.0,1.0,0.0,0.0,VMC,,"The pilots failure to maintain adequate clearance from trees during a precautionary landing. Contributing to the accident was the pilots inadequate preflight inspection during which he failed to detect a loose drive belt, which resulted in an in-flight shudder. 
",2014.0
20141113X54904,Accident,2014-11-13,"Panguitch, UT",United States,Non-Fatal,Substantial,Helicopter,AEROSPATIALE,AS350BA,No,1.0,Turbo Shaft,091,,Instructional,Southern Utah University,0.0,2.0,0.0,0.0,VMC,,The flight instructor's delayed reaction in taking control of the helicopter during a student pilot's loss of control while landing.,2014.0
20141117X15544,Accident,2014-11-15,"Prescott, AZ",United States,Non-Fatal,Substantial,Helicopter,ROBINSON HELICOPTER,R22 BETA,No,1.0,Reciprocating,091,,Instructional,"Guidance Academy, LLC",0.0,2.0,0.0,0.0,VMC,,The certified flight instructor's failure to maintain helicopter control during the autorotation which resulted in a hard landing and subsequent roll over.,2014.0
20141119X50954,Accident,2014-11-18,"Decatur, AL",United States,Non-Fatal,Substantial,Helicopter,MCDONNELL DOUGLAS HELICOPTER,MD500,No,1.0,Turbo Shaft,133,,External Load,HAVERFIELD INTERNATIONAL INC,0.0,0.0,0.0,2.0,VMC,,An undetermined pilot's failure to maintain clearance from an electrical transmission tower resulting in substantial damage to a main rotor blade. Postaccident investigation could not determine which of two pilots was flying the helicopter at the time the damage occurred.,2014.0
20141128X82658,Accident,2014-11-24,"Leesburg, VA",United States,Non-Fatal,Substantial,Helicopter,HILLER,OH 23B,No,1.0,Reciprocating,091,,Instructional,VERTICALLY CHALLENGED LLC,0.0,0.0,0.0,2.0,VMC,,A loss of tail rotor effectiveness while hovering in gusting crosswind conditions resulting in the student pilot's loss of control of the helicopter. Contributing was the delayed remedial action of the flight instructor.,2014.0
20141204X91829,Accident,2014-11-27,"Highlandville, MO",United States,Non-Fatal,Substantial,Helicopter,MD HELICOPTER INC,MD 900,No,2.0,Turbo Shaft,135,NSCH,,Air Methods Corporation,0.0,1.0,0.0,2.0,VMC,,The pilot's inability to identify the power line during the initial approach in night visual meteorological conditions and his subsequent failure to avoid the power line once he identified it on final approach.,2014.0
20141209X12845,Accident,2014-11-29,"Dar es Salaam, Tanzania, United Republic of",Tanzania,Fatal,Destroyed,Helicopter,ROBINSON,R44 - II,No,,,NUSC,,,,4.0,0.0,0.0,0.0,,,,2014.0
20141202X73240,Accident,2014-12-02,"Bountiful, UT",United States,Fatal,Substantial,Helicopter,ROBINSON HELICOPTER COMPANY,R44,No,1.0,Reciprocating,091,,Personal,Native Range Inc.,2.0,0.0,0.0,0.0,VMC,,"The pilot/mechanic's failure to properly secure the pitch link hardware of one main rotor blade to the rotating swash plate, which resulted in the pitch link separating in flight and a subsequent loss of control.",2014.0
20141208X45533,Accident,2014-12-04,"Ponte de Sor, Portugal",Portugal,Fatal,Destroyed,Helicopter,SCHWEIZER,269C - 1,No,,,NUSN,,Instructional,Escola de Aviação Aerocondor,2.0,0.0,0.0,0.0,Unk,,,2014.0
20141222X60930,Accident,2014-12-08,"Fort Lupton, CO",United States,Non-Fatal,Substantial,Helicopter,ENSTROM,280FX,No,1.0,Reciprocating,091,,Instructional,Mountain One Helicopters,0.0,1.0,0.0,0.0,VMC,,The loss of engine power during cruise flight for reasons that could not be determined based on the available information.,2014.0
20150120X22925,Accident,2014-12-15,"Lake Siutghiol, Romania",Romania,Fatal,Substantial,Helicopter,AIRBUS HELICOPTER,EC135T2+,No,,,,,,,4.0,0.0,0.0,0.0,,,,2014.0
20141217X23603,Accident,2014-12-16,"Bicknell, UT",United States,Non-Fatal,Substantial,Helicopter,EUROCOPTER,AS 350 B2 ECUREUIL,No,1.0,Turbo Shaft,091,,Other Work Use,Utah Highway Patrol,0.0,0.0,0.0,4.0,VMC,,"The pilot's failure to prevent the helicopter from settling with power while maneuvering at a low altitude, which resulted in a loss of control and subsequent hard landing.",2014.0
20141224X24922,Accident,2014-12-21,"Miami Gardens, FL",United States,Non-Fatal,Substantial,Helicopter,BELL,430,No,2.0,Turbo Shaft,091,,Executive/corporate,SOUTHERN AIRCRAFT SERVICES INC,0.0,0.0,0.0,7.0,VMC,,The pilot's misjudgment of his helicopter's position relative to a parked helicopter during a pedal turn.,2014.0
20141222X43102,Accident,2014-12-22,"Henniker, NH",United States,Non-Fatal,Substantial,Helicopter,ROBINSON HELICOPTER CO,R66,No,1.0,Turbo Shaft,091,,Personal,HILLSBORO FORD INC,0.0,0.0,0.0,1.0,VMC,,"The pilot's failure to maintain aircraft control while landing, which resulted in a collision with a snow bank. Contributing to the accident was ice that covered the landing surface.",2014.0
20150113X15218,Accident,2014-12-27,"Bertioga, Brazil",Brazil,Fatal,Destroyed,Helicopter,AEROSPATIALE,AS350B,No,,,NUSC,NSCH,,Helimarte Taxi Aereo,5.0,0.0,0.0,0.0,VMC,,,2014.0
20141229X15321,Accident,2014-12-29,"Lake Worth, FL",United States,Fatal,Substantial,Helicopter,ROBINSON HELICOPTER,R22 BETA,No,1.0,Reciprocating,091,,Instructional,,1.0,0.0,1.0,0.0,VMC,,"A main rotor stall due to low rotor rpm, which resulted in an uncontrolled descent into terrain. Contributing to the accident was the flight instructors delayed remedial action. ",2014.0
20150105X12648,Accident,2014-12-29,"Horseshoe Bay, TX",United States,Non-Fatal,Substantial,Helicopter,ROBINSON HELICOPTER COMPANY,R44 II,No,1.0,Reciprocating,091,,Personal,,0.0,0.0,0.0,1.0,VMC,,The helicopter's contact with the landing pad during a rejected landing.,2014.0
20141231X83422,Accident,2014-12-31,"Las Vegas, NV",United States,Non-Fatal,Substantial,Helicopter,MD HELICOPTER INC,369FF,No,1.0,Turbo Shaft,PUBU,,Public Aircraft - Local,LAS VEGAS METROPOLITAN POLICE DEPARTMENT,0.0,0.0,2.0,0.0,VMC,,A total loss of engine power during cruise flight for reasons that could not be determined because postaccident examination and testing did not reveal any anomalies that would have precluded normal operation.,2014.0
20150101X15630,Accident,2015-01-01,"Benson, AZ",United States,Fatal,Destroyed,Helicopter,BELL,206,No,1.0,Turbo Shaft,091,,Positioning,N57AW LLC,2.0,0.0,0.0,0.0,IMC,,"The pilots continued visual flight into instrument meteorological conditions which resulted in an inflight collision with terrain. Contributing to the accident was the pilots inadequate preflight planning, during which he failed to identify forecasted deteriorating weather conditions along the route of flight.",2015.0
20150103X94415,Accident,2015-01-02,"Barranquitas, PR",United States,Non-Fatal,Substantial,Helicopter,ROBINSON HELICOPTER COMPANY,R44 II,No,1.0,Reciprocating,091,,Personal,,0.0,1.0,0.0,2.0,VMC,,The pilot's failure to maintain control of the helicopter while landing which resulted in a tailrotor ground strike and collision with terrain.,2015.0
20150110X10017,Accident,2015-01-10,"Catano, PR",United States,Fatal,Destroyed,Helicopter,ROBINSON HELICOPTER,R22 BETA,No,1.0,Reciprocating,091,,Instructional,VERTICAL SOLUTIONS HELICOPTER COMPANY LL,1.0,0.0,0.0,0.0,VMC,,"The student pilots  failure to maintain rotor rpm while maneuvering in the airport traffic pattern, which resulted in the helicopters uncontrolled descent to the water. Contributing to the accident was the students distraction with other aircraft operating in the traffic pattern. ",2015.0
20150116X44922,Accident,2015-01-10,"Santa Monica, Brazil",Brazil,Fatal,Destroyed,Helicopter,ROBINSON,R44 - II,No,,,NUSN,,Personal,,1.0,0.0,1.0,0.0,,,,2015.0
20150123X32410,Accident,2015-01-13,"Guayaquil, Spain",Spain,Non-Fatal,Substantial,Helicopter,HAL,DHRUV,No,,,ARMF,,,,0.0,2.0,0.0,0.0,,,,2015.0
20150116X65836,Accident,2015-01-16,"The Woodlands, TX",United States,Fatal,Substantial,Helicopter,BAKER BOBBY J,SAFARI,Yes,1.0,Reciprocating,091,,Personal,,1.0,0.0,0.0,0.0,VMC,,"An in-flight separation of the helicopters horizontal stabilizer due to undetected fatigue cracking of the stabilizer spar, which resulted in a loss of control.",2015.0
20150126X41009,Accident,2015-01-17,"Santa Catarina Ixtahuacan, Guatemala",Guatemala,Non-Fatal,Destroyed,Helicopter,BELL,206 - L1,No,,Turbo Shaft,NUSC,,,,0.0,4.0,0.0,0.0,,,,2015.0
20150120X75714,Accident,2015-01-20,"Tashanta, Russia",Russia,Non-Fatal,Substantial,Helicopter,ROBINSON,R66,No,,,NUSN,,,"Kustard, JSC",0.0,0.0,0.0,3.0,,,,2015.0
20150224X70026,Accident,2015-01-23,"Waikaia, New Zealand",New Zealand,Non-Fatal,Substantial,Helicopter,ROBINSON,R44 - II,No,,,,,,,0.0,0.0,0.0,1.0,,,,2015.0
20150128X02848,Accident,2015-01-26,"Erie, CO",United States,Fatal,Destroyed,Helicopter,ENSTROM,280FX,No,1.0,Reciprocating,091,,Instructional,,2.0,0.0,0.0,0.0,VMC,,"An in-flight failure of the helicopter's #2 main rotor spindle due to undetected fatigue cracking, which resulted in an in-flight breakup. Contributing to failure were the nonconforming thread root radius of the spindle and the manufacturer's failure to include a bending moment within the spindle threads when performing the fatigue analysis during initial design of the spindle.",2015.0
20150130X44408,Accident,2015-01-27,"Tena, Spain",Spain,Fatal,Destroyed,Helicopter,HAL,DHRUV,No,,,ARMF,,,,3.0,0.0,0.0,0.0,,,,2015.0
20150130X12418,Accident,2015-01-29,"North Little Rock, AR",United States,Non-Fatal,Substantial,Helicopter,BELL-WATSON,47 G,No,1.0,Reciprocating,091,,Instructional,,0.0,0.0,0.0,2.0,VMC,,"The flight instructors failure to maintain adequate rotor rpm during the practice touchdown autorotation, which resulted in a subsequent loss of helicopter control and impact with terrain.",2015.0
20150201X23855,Accident,2015-01-31,"Seadrift, TX",United States,Non-Fatal,Substantial,Helicopter,BUTLER RAYMOND,ROTORWAY EXEC 162F,Yes,1.0,Reciprocating,091,,Personal,BUTLER WILLIAM RAYMOND,0.0,0.0,0.0,2.0,VMC,,"A fault in the No. 1 engine control module, which disabled the ignition system and resulted in the engine losing power; during the subsequent autorotation, the main rotor rpm was further reduced just before touchdown, which resulted in a hard landing.",2015.0
20150202X83148,Accident,2015-02-01,"Calexico, CA",United States,Non-Fatal,Substantial,Helicopter,ROBINSON HELICOPTER COMPANY,R44 II,No,1.0,Reciprocating,137,,Aerial Application,John Reed Aviation,0.0,0.0,0.0,1.0,VMC,,"A partial loss of engine power for reasons that could not be determined because postaccident examination of the airframe and engine did not reveal any anomalies that would have precluded normal operation. 
",2015.0
20150211X84924,Accident,2015-02-01,"Carthage, NY",United States,Non-Fatal,Substantial,Helicopter,SCHWEIZER,269C 1,No,1.0,Reciprocating,091,,Personal,,0.0,0.0,0.0,2.0,VMC,,"The non-helicopter-rated pilot's improper decision to operate the helicopter at low-level and his inability to adequately see the horizon over snow and ice, which resulted in controlled flight into terrain.",2015.0
20150305X10103,Accident,2015-02-06,"Oresten, Sweden",Sweden,Non-Fatal,Substantial,Helicopter,HUGHES,269A,No,1.0,Reciprocating,NUSN,,Personal,,0.0,0.0,0.0,1.0,,,,2015.0
20150213X34718,Accident,2015-02-12,"Bohusovice nad Ohri, Czech Republic",Czech Republic,Fatal,Destroyed,Helicopter,JUDR ZDENEK PRAZDNY,ROTORWAY,Yes,,,NUSN,,,,1.0,0.0,0.0,0.0,,,,2015.0
20150225X45502,Accident,2015-02-15,"Asherton, TX",United States,Non-Fatal,Substantial,Helicopter,ROBINSON HELICOPTER,R22 BETA,No,1.0,Reciprocating,091,,Other Work Use,"Southwest Texas Helicopters, Inc",0.0,1.0,0.0,0.0,VMC,,The pilot did not maintain adequate clearance from the trees.,2015.0
20150226X64850,Accident,2015-02-15,"Sevierville, TN",United States,Non-Fatal,Substantial,Helicopter,BELL,206,No,1.0,Turbo Shaft,091,,Aerial Observation,Great Smoky Mountain Helicopter Inc,0.0,0.0,0.0,6.0,VMC,,"An uncontained engine failure, which resulted from insufficient lubrication of the No. 4 bearing due to carbon buildup on the filter screen of the bearing's oil supply nozzle.",2015.0
20150309X14354,Accident,2015-02-15,"Wabo, Papua New Guinea, Papua New Guinea",Papua New Guinea,Non-Fatal,Substantial,Helicopter,BELL,206 - L4,No,,,,,,,0.0,0.0,0.0,1.0,,,,2015.0
20150220X45640,Accident,2015-02-19,"Queenstown, New Zealand, New Zealand",New Zealand,Fatal,Substantial,Helicopter,ROBINSON,R44 II,No,1.0,Reciprocating,,,,,2.0,0.0,0.0,0.0,,,,2015.0
20150220X74821,Accident,2015-02-19,"Shelton, WA",United States,Non-Fatal,Substantial,Helicopter,BELL/GARLICK,UH 1H,No,1.0,Turbo Shaft,137,,External Load,NORTHWEST HELICOPTERS LLC,0.0,0.0,0.0,1.0,VMC,,"The fatigue failure of the engine-to-transmission driveshaft adapter attachment bolt due to the application of inadequate torque on the bolt during assembly.
",2015.0
20150225X31336,Accident,2015-02-20,"Gulf of Mexico,",United States,Non-Fatal,Substantial,Helicopter,AGUSTA AEROSPACE CORP,AW119 MKII,No,1.0,Turbo Shaft,135,NSCH,,ERA HELICOPTERS LLC,0.0,0.0,0.0,2.0,VMC,,"The fracture of the tail rotor pitch change link due to excessive bearing rotational friction, which resulted from the bearings being installed in exceedance of the maximum allowable torque during the last overhaul of the pitch change link.",2015.0
20150227X93828,Accident,2015-02-26,"Plymouth, IN",United States,Non-Fatal,Substantial,Helicopter,GADDIS MICHAEL,EXEC 162 F,Yes,1.0,Reciprocating,091,,Personal,,0.0,0.0,0.0,2.0,VMC,,"The failure of the helicopter's main drive belt resulting in the pilot performing a forced landing, during which the helicopter's fuselage was substantially damage.",2015.0
